{
  "$schema": "https://jantt.dev/schema/v1.json",
  "meta": {
    "title": "Master Kitchen-Sink Specification & Benchmark Cheatsheet",
    "description": "The definitive benchmark reference template demonstrating 100% of Jantt schema capabilities: WBS hierarchies, multi-dependencies, locked constraints, urgent alerts, planned vs actual baselines, granular progress tracking, budget analysis, category definitions, and custom metadata attributes.",
    "person": "Lead Technical Program Director",
    "organization": "Acme Global Engineering & Architecture",
    "start": "2026-09-01",
    "end": "2027-01-31",
    "defaultGapDays": 2,
    "scale": "week",
    "linkRouting": "orthogonal",
    "showCriticalPath": false,
    "showBaselines": true,
    "currency": "USD",
    "budget": 385000,
    "version": "1.2.0",
    "generatedAt": "2026-08-29T19:00:00.000Z"
  },
  "categories": {
    "specs": {
      "label": "Architecture & Specs",
      "color": "#3B82F6",
      "soft": "#1E293B",
      "icon": "file-text"
    },
    "core": {
      "label": "Core Engine & Services",
      "color": "#10B981",
      "soft": "#064E3B",
      "icon": "cpu"
    },
    "ui": {
      "label": "Frontend & Design System",
      "color": "#8B5CF6",
      "soft": "#312E81",
      "icon": "layout"
    },
    "security": {
      "label": "Security & Compliance",
      "color": "#F59E0B",
      "soft": "#78350F",
      "icon": "shield-check"
    },
    "devops": {
      "label": "Cloud & Infrastructure",
      "color": "#06B6D4",
      "soft": "#083344",
      "icon": "cloud"
    },
    "qa": {
      "label": "QA & Test Automation",
      "color": "#E11D48",
      "soft": "#4C0519",
      "icon": "check-circle"
    },
    "release": {
      "label": "Deployment & Release",
      "color": "#EC4899",
      "soft": "#831843",
      "icon": "rocket"
    }
  },
  "documents": [
    {
      "id": "doc-arch-rfc",
      "label": "RFC-204: Global Event-Driven Mesh Architecture",
      "status": "have",
      "owner": "Sarah Chen",
      "url": "https://wiki.acme.corp/rfc/204",
      "note": "Approved unanimously by Architecture Review Board on Aug 24"
    },
    {
      "id": "doc-soc2-audit",
      "label": "SOC2 Type II & ISO 27001 Security Checklist",
      "status": "pending",
      "owner": "Marcus Brody",
      "url": "https://compliance.acme.corp/soc2-audit",
      "note": "Under audit review with external auditor"
    },
    {
      "id": "doc-legal-sla",
      "label": "Global Service Level Agreement & Privacy Policy v2",
      "status": "missing",
      "owner": "Legal Counsel",
      "url": "https://legal.acme.corp/sla-v2",
      "note": "Mandatory blocker for GA production rollout"
    }
  ],
  "tasks": [
    {
      "id": "task-spec-schema",
      "wbs": "1.1",
      "label": "API Contracts, Protocol Buffers & JSON Schemas",
      "category": "specs",
      "start": "2026-09-01",
      "end": "2026-09-14",
      "assignee": "Sarah Chen",
      "priority": "high",
      "estimatedCost": 28000,
      "actualCost": 27500,
      "dependsOn": null,
      "gapDays": 0,
      "locked": true,
      "progress": 1.0,
      "milestone": false,
      "status": "completed",
      "urgent": false,
      "baseline": {
        "start": "2026-09-01",
        "end": "2026-09-12"
      },
      "notes": "Formalize OpenAPI 3.1 contracts, TypeScript interfaces, and bidirectional JSON schema validation rules.",
      "fields": {
        "deliverable": "packages/schema/v1.json",
        "jira": "JANTT-101",
        "storyPoints": 13,
        "team": "Core Architecture"
      }
    },
    {
      "id": "task-spec-security",
      "wbs": "1.2",
      "label": "Threat Modeling & Zero-Trust Auth Architecture",
      "category": "specs",
      "start": "2026-09-03",
      "end": "2026-09-16",
      "assignee": "Marcus Brody",
      "priority": "urgent",
      "estimatedCost": 24000,
      "actualCost": 23500,
      "dependsOn": null,
      "gapDays": 0,
      "locked": true,
      "progress": 1.0,
      "milestone": false,
      "status": "completed",
      "urgent": false,
      "baseline": {
        "start": "2026-09-01",
        "end": "2026-09-15"
      },
      "notes": "Define OAuth 2.1 mTLS mutual authentication and RBAC permission matrices.",
      "fields": {
        "deliverable": "docs/security-architecture.md",
        "jira": "JANTT-102",
        "storyPoints": 8,
        "team": "SecOps"
      }
    },
    {
      "id": "task-gate-1",
      "wbs": "1.3",
      "label": "Milestone 1: Technical Blueprint Signoff & Gate 1",
      "category": "specs",
      "start": "2026-09-17",
      "end": "2026-09-17",
      "assignee": "Sarah Chen",
      "priority": "urgent",
      "estimatedCost": 5000,
      "actualCost": 5000,
      "dependsOn": ["task-spec-schema", "task-spec-security"],
      "gapDays": 1,
      "locked": true,
      "progress": 1.0,
      "milestone": true,
      "status": "completed",
      "urgent": false,
      "notes": "Formal executive checkpoint gating all backend, UI, and infrastructure implementation phases.",
      "fields": {
        "reviewBoard": "Executive Tech Council",
        "gateId": "G1-SPECS"
      }
    },
    {
      "id": "task-core-services",
      "wbs": "2.1",
      "label": "High-Performance DAG Constraint Solver Engine",
      "category": "core",
      "start": "2026-09-19",
      "end": "2026-10-22",
      "assignee": "Alex Rivera",
      "priority": "urgent",
      "estimatedCost": 72000,
      "actualCost": 54000,
      "dependsOn": "task-gate-1",
      "gapDays": 2,
      "locked": false,
      "progress": 0.75,
      "milestone": false,
      "status": "in-progress",
      "urgent": true,
      "baseline": {
        "start": "2026-09-17",
        "end": "2026-10-18"
      },
      "notes": "Zero-dependency pure TypeScript topological dependency resolver and critical path calculation engine.",
      "fields": {
        "repo": "github.com/acme/jantt-core",
        "coverageTarget": "95%",
        "jira": "JANTT-201",
        "storyPoints": 21
      }
    },
    {
      "id": "task-db-pipeline",
      "wbs": "2.2",
      "label": "Distributed Data Ingestion & Streaming Pipeline",
      "category": "core",
      "start": "2026-09-19",
      "end": "2026-10-14",
      "assignee": "David Kim",
      "priority": "high",
      "estimatedCost": 48000,
      "actualCost": 38000,
      "dependsOn": "task-gate-1",
      "gapDays": 2,
      "locked": false,
      "progress": 0.85,
      "milestone": false,
      "status": "in-progress",
      "urgent": false,
      "baseline": {
        "start": "2026-09-17",
        "end": "2026-10-10"
      },
      "notes": "Scalable Apache Kafka streaming consumer and PostgreSQL schema migration pipelines.",
      "fields": {
        "throughputTarget": "100k msg/sec",
        "jira": "JANTT-202",
        "storyPoints": 13
      }
    },
    {
      "id": "task-ui-components",
      "wbs": "2.3",
      "label": "Swiss Modern 2.0 Timeline Canvas & Interaction Engine",
      "category": "ui",
      "start": "2026-09-19",
      "end": "2026-10-18",
      "assignee": "Elena Rostova",
      "priority": "high",
      "estimatedCost": 58000,
      "actualCost": 42000,
      "dependsOn": "task-gate-1",
      "gapDays": 2,
      "locked": false,
      "progress": 0.70,
      "milestone": false,
      "status": "in-progress",
      "urgent": false,
      "baseline": {
        "start": "2026-09-17",
        "end": "2026-10-14"
      },
      "notes": "Interactive SVG dependency links, multi-touch drag handlers, live zoom scales, and precision glassmorphism.",
      "fields": {
        "figma": "figma.com/@acme/swiss-jantt",
        "framework": "React 18 + Vanilla CSS",
        "jira": "JANTT-203",
        "storyPoints": 21
      }
    },
    {
      "id": "task-api-gateway",
      "wbs": "2.4",
      "label": "GraphQL & RESTful API Gateway Mesh",
      "category": "core",
      "start": "2026-10-24",
      "end": "2026-11-10",
      "assignee": "Alex Rivera",
      "priority": "medium",
      "estimatedCost": 32000,
      "actualCost": 12000,
      "dependsOn": ["task-core-services", "task-db-pipeline"],
      "gapDays": 2,
      "locked": false,
      "progress": 0.40,
      "milestone": false,
      "status": "in-progress",
      "urgent": false,
      "baseline": {
        "start": "2026-10-20",
        "end": "2026-11-06"
      },
      "notes": "Reverse proxy routing layer with JWT verification, rate limiting, and distributed tracing.",
      "fields": {
        "latencySLA": "< 15ms p99",
        "jira": "JANTT-204",
        "storyPoints": 13
      }
    },
    {
      "id": "task-gate-2",
      "wbs": "3.0",
      "label": "Milestone 2: Alpha Feature Freeze & Live Showcase",
      "category": "release",
      "start": "2026-11-12",
      "end": "2026-11-12",
      "assignee": "Lead Technical Program Director",
      "priority": "urgent",
      "estimatedCost": 8000,
      "actualCost": 0,
      "dependsOn": ["task-ui-components", "task-api-gateway"],
      "gapDays": 2,
      "locked": true,
      "progress": 0.0,
      "milestone": true,
      "status": "not-started",
      "urgent": false,
      "notes": "Live stakeholder demonstration and feature-freeze lockdown before security audit and QA validation.",
      "fields": {
        "audience": "Product Leadership & Key Customers",
        "gateId": "G2-ALPHA"
      }
    },
    {
      "id": "task-sec-audit",
      "wbs": "3.1",
      "label": "Third-Party Penetration Testing & SOC2 Audit",
      "category": "security",
      "start": "2026-11-14",
      "end": "2026-12-08",
      "assignee": "Marcus Brody",
      "priority": "urgent",
      "estimatedCost": 45000,
      "actualCost": 0,
      "dependsOn": "task-gate-2",
      "gapDays": 2,
      "locked": false,
      "progress": 0.0,
      "milestone": false,
      "status": "not-started",
      "urgent": true,
      "baseline": {
        "start": "2026-11-10",